{
  "schemaVersion": 1,
  "integrationKind": "other",
  "themeRevision": "93af9ff0cffb1b4ac6cc1e1d66cc1613d40d948f",
  "surfaces": {
    "interface": {
      "state": "supported",
      "reason": "Chat lists, settings, profiles, search, message text and app chrome use canonical rose text on dark surfaces."
    },
    "messages": {
      "state": "supported",
      "reason": "Dark incoming/outgoing bubbles, selection, replies, links, metadata and media controls are colour-mapped."
    },
    "controls": {
      "state": "supported",
      "reason": "Composer, menus, dialogs, attachment and emoji panel chrome, focus-colour hooks and translucent selectors are mapped."
    },
    "wallpaper": {
      "state": "supported",
      "reason": "Two existing dark surface roles produce a static Android wallpaper and a 1×2 Desktop RGB background."
    },
    "typography": {
      "state": "inherited",
      "reason": "Telegram owns family, weight, size and line metrics; bold keeps the text role."
    },
    "geometry": {
      "state": "unsupported",
      "reason": "Native theme formats expose colours, not square radii, border widths, focus-ring shapes or spacing."
    },
    "motion": {
      "state": "inherited",
      "reason": "Telegram controls motion and reduced-motion preferences; no animated wallpaper is emitted."
    },
    "content-data": {
      "state": "inherited",
      "reason": "Photos, videos, user accents, chart data and Premium/story artwork remain host content."
    },
    "developer-surfaces": {
      "state": "out-of-scope",
      "reason": "This interface port has no terminal palette, diagnostic/diff model or hued syntax opt-in."
    },
    "primitives": {
      "state": "out-of-scope",
      "reason": "Only semantic role mappings are eligible for delivery."
    }
  },
  "roles": {
    "color.primitive.ink.0": {
      "state": "out-of-scope",
      "surface": "primitives",
      "reason": "Primitives are blocked inspection values; Telegram consumes semantic roles only."
    },
    "color.primitive.ink.14": {
      "state": "out-of-scope",
      "surface": "primitives",
      "reason": "Primitives are blocked inspection values; Telegram consumes semantic roles only."
    },
    "color.primitive.ink.15": {
      "state": "out-of-scope",
      "surface": "primitives",
      "reason": "Primitives are blocked inspection values; Telegram consumes semantic roles only."
    },
    "color.primitive.ink.20": {
      "state": "out-of-scope",
      "surface": "primitives",
      "reason": "Primitives are blocked inspection values; Telegram consumes semantic roles only."
    },
    "color.primitive.ink.25": {
      "state": "out-of-scope",
      "surface": "primitives",
      "reason": "Primitives are blocked inspection values; Telegram consumes semantic roles only."
    },
    "color.primitive.ink.28": {
      "state": "out-of-scope",
      "surface": "primitives",
      "reason": "Primitives are blocked inspection values; Telegram consumes semantic roles only."
    },
    "color.primitive.ink.30": {
      "state": "out-of-scope",
      "surface": "primitives",
      "reason": "Primitives are blocked inspection values; Telegram consumes semantic roles only."
    },
    "color.primitive.ink.40": {
      "state": "out-of-scope",
      "surface": "primitives",
      "reason": "Primitives are blocked inspection values; Telegram consumes semantic roles only."
    },
    "color.primitive.ink.52": {
      "state": "out-of-scope",
      "surface": "primitives",
      "reason": "Primitives are blocked inspection values; Telegram consumes semantic roles only."
    },
    "color.primitive.ink.60": {
      "state": "out-of-scope",
      "surface": "primitives",
      "reason": "Primitives are blocked inspection values; Telegram consumes semantic roles only."
    },
    "color.primitive.red.40": {
      "state": "out-of-scope",
      "surface": "primitives",
      "reason": "Primitives are blocked inspection values; Telegram consumes semantic roles only."
    },
    "color.primitive.red.50": {
      "state": "out-of-scope",
      "surface": "primitives",
      "reason": "Primitives are blocked inspection values; Telegram consumes semantic roles only."
    },
    "color.primitive.red.100": {
      "state": "out-of-scope",
      "surface": "primitives",
      "reason": "Primitives are blocked inspection values; Telegram consumes semantic roles only."
    },
    "color.primitive.red.150": {
      "state": "out-of-scope",
      "surface": "primitives",
      "reason": "Primitives are blocked inspection values; Telegram consumes semantic roles only."
    },
    "color.primitive.red.200": {
      "state": "out-of-scope",
      "surface": "primitives",
      "reason": "Primitives are blocked inspection values; Telegram consumes semantic roles only."
    },
    "color.primitive.red.250": {
      "state": "out-of-scope",
      "surface": "primitives",
      "reason": "Primitives are blocked inspection values; Telegram consumes semantic roles only."
    },
    "color.primitive.red.300": {
      "state": "out-of-scope",
      "surface": "primitives",
      "reason": "Primitives are blocked inspection values; Telegram consumes semantic roles only."
    },
    "color.primitive.red.350": {
      "state": "out-of-scope",
      "surface": "primitives",
      "reason": "Primitives are blocked inspection values; Telegram consumes semantic roles only."
    },
    "color.primitive.red.400": {
      "state": "out-of-scope",
      "surface": "primitives",
      "reason": "Primitives are blocked inspection values; Telegram consumes semantic roles only."
    },
    "color.primitive.red.450": {
      "state": "out-of-scope",
      "surface": "primitives",
      "reason": "Primitives are blocked inspection values; Telegram consumes semantic roles only."
    },
    "color.primitive.red.500": {
      "state": "out-of-scope",
      "surface": "primitives",
      "reason": "Primitives are blocked inspection values; Telegram consumes semantic roles only."
    },
    "color.primitive.red.550": {
      "state": "out-of-scope",
      "surface": "primitives",
      "reason": "Primitives are blocked inspection values; Telegram consumes semantic roles only."
    },
    "color.primitive.red.650": {
      "state": "out-of-scope",
      "surface": "primitives",
      "reason": "Primitives are blocked inspection values; Telegram consumes semantic roles only."
    },
    "color.primitive.red.750": {
      "state": "out-of-scope",
      "surface": "primitives",
      "reason": "Primitives are blocked inspection values; Telegram consumes semantic roles only."
    },
    "color.primitive.red.760": {
      "state": "out-of-scope",
      "surface": "primitives",
      "reason": "Primitives are blocked inspection values; Telegram consumes semantic roles only."
    },
    "color.primitive.red.770": {
      "state": "out-of-scope",
      "surface": "primitives",
      "reason": "Primitives are blocked inspection values; Telegram consumes semantic roles only."
    },
    "color.primitive.red.800": {
      "state": "out-of-scope",
      "surface": "primitives",
      "reason": "Primitives are blocked inspection values; Telegram consumes semantic roles only."
    },
    "color.primitive.red.810": {
      "state": "out-of-scope",
      "surface": "primitives",
      "reason": "Primitives are blocked inspection values; Telegram consumes semantic roles only."
    },
    "color.primitive.red.850": {
      "state": "out-of-scope",
      "surface": "primitives",
      "reason": "Primitives are blocked inspection values; Telegram consumes semantic roles only."
    },
    "color.primitive.red.860": {
      "state": "out-of-scope",
      "surface": "primitives",
      "reason": "Primitives are blocked inspection values; Telegram consumes semantic roles only."
    },
    "color.primitive.rose.300": {
      "state": "out-of-scope",
      "surface": "primitives",
      "reason": "Primitives are blocked inspection values; Telegram consumes semantic roles only."
    },
    "color.primitive.rose.320": {
      "state": "out-of-scope",
      "surface": "primitives",
      "reason": "Primitives are blocked inspection values; Telegram consumes semantic roles only."
    },
    "color.primitive.rose.350": {
      "state": "out-of-scope",
      "surface": "primitives",
      "reason": "Primitives are blocked inspection values; Telegram consumes semantic roles only."
    },
    "color.primitive.rose.450": {
      "state": "out-of-scope",
      "surface": "primitives",
      "reason": "Primitives are blocked inspection values; Telegram consumes semantic roles only."
    },
    "color.primitive.rose.550": {
      "state": "out-of-scope",
      "surface": "primitives",
      "reason": "Primitives are blocked inspection values; Telegram consumes semantic roles only."
    },
    "color.primitive.rose.600": {
      "state": "out-of-scope",
      "surface": "primitives",
      "reason": "Primitives are blocked inspection values; Telegram consumes semantic roles only."
    },
    "color.primitive.rose.650": {
      "state": "out-of-scope",
      "surface": "primitives",
      "reason": "Primitives are blocked inspection values; Telegram consumes semantic roles only."
    },
    "color.primitive.rose.700": {
      "state": "out-of-scope",
      "surface": "primitives",
      "reason": "Primitives are blocked inspection values; Telegram consumes semantic roles only."
    },
    "color.primitive.rose.800": {
      "state": "out-of-scope",
      "surface": "primitives",
      "reason": "Primitives are blocked inspection values; Telegram consumes semantic roles only."
    },
    "color.primitive.coral.700": {
      "state": "out-of-scope",
      "surface": "primitives",
      "reason": "Primitives are blocked inspection values; Telegram consumes semantic roles only."
    },
    "color.primitive.paper.90": {
      "state": "out-of-scope",
      "surface": "primitives",